[
  {
    "code": "IGE",
    "name": "PGR_RELATEDTO_NAME_IGE",
    "active": true,
    "shortName": "IGE",
    "displayOrder": 1,
    "tenantId": "mz",
    "tenantCode": "mz"
  },
  {
    "code": "IGSAE",
    "name": "PGR_RELATEDTO_NAME_IGSAE",
    "active": false,
    "shortName": "IGSAE",
    "displayOrder": 2,
    "tenantId": "mz",
    "tenantCode": "mz"
  }
]
